{
  "$comment": "output/kb/ 그래프 산출물의 계약. 관계 값 도메인, 간선 추가 요건, 임포트 불변식을 선언한다.",
  "outBase": "output/kb",
  "relations": {
    "적용대상": { "from": "규정", "to": "용지·시설", "meaning": "규정이 적용되는 대상", "origin": "지구" },
    "부착": { "from": "요소", "to": "상위 요소", "meaning": "물리적·구조적 부속", "origin": "지구" },
    "허용_불허": { "from": "용지", "to": "용도", "meaning": "건축 가능 여부", "origin": "지구" },
    "구성": { "from": "상위 개념", "to": "하위 구성요소", "meaning": "부분-전체", "origin": "지구" },
    "조성의무": { "from": "주체", "to": "시설", "meaning": "조성 의무 부과", "origin": "지구" },
    "근거법령": { "from": "규정", "to": "법령", "meaning": "법적 근거", "origin": "지구" },
    "준용": { "from": "조문", "to": "조문", "meaning": "A 조문이 B 조문의 기준을 따르도록 정한다", "origin": "법령" },
    "위임": { "from": "조문", "to": "하위법령·조례", "meaning": "A 조문이 기준 결정을 하위 규범에 맡긴다", "origin": "법령" },
    "완화": { "from": "조문", "to": "조문", "meaning": "A 조문이 B 조문의 적용을 완화할 근거를 준다", "origin": "법령" }
  },
  "relationOrigins": {
    "설명": "간선이 어디서 나오는지에 따라 요건이 다르다. 섞으면 어느 쪽 요건도 강제할 수 없다.",
    "지구": "지구별 시행지침 문서에서 나온다. 지구번호와 원문 문장이 근거다",
    "법령": "상위법령 조문에서 나온다. 지구번호가 없고 조문 출처와 시행일이 근거다"
  },
  "edgeRequirements": {
    "공통": [
      "근거가 없는 간선은 추가하지 않는다",
      "구조에서 유추한 관계는 추가하지 않는다. 검증된 간선과 구분할 수 없게 된다"
    ],
    "origin=지구": [
      "정의문 원문에 그 관계를 진술하는 문장이 실재해야 한다",
      "출처 지구번호를 기록해야 한다",
      "두 요건 중 하나라도 없으면 간선을 추가하지 않는다"
    ],
    "origin=법령": [
      "조문 출처(URL)와 시행일을 기록해야 한다. 법령은 개정되므로 시점 없는 조문 인용은 근거가 되지 않는다",
      "그 관계를 진술하는 조문 문장을 근거로 기록해야 한다",
      "검증상태가 정본대조가 아닌 법령·조문에서는 간선을 추가하지 않는다. 미대조 표기는 정식 명칭이 아니다"
    ]
  },
  "importRules": {
    "idempotent": true,
    "idempotentNote": "같은 입력을 두 번 임포트해도 결과가 같아야 한다",
    "filterFlags": ["source_quality", "classification_confidence", "검증상태", "resolution"],
    "filterFlagsNote": "OCR·저신뢰·미대조·상대참조해소 항목을 질의에서 걸러낼 수 있도록 스키마에 둔다",
    "countReconciliation": "입력 JSON 항목 수와 임포트된 노드·간선 수를 대조표로 남긴다. 차이가 있으면 누락 사유를 기록한다"
  },
  "invariants": [
    "고아 노드가 없다",
    "모든 관계의 양끝 노드가 실재한다 (dangling 없음)",
    "origin=지구 인 모든 관계에 출처(지구번호·원문 근거)가 있다",
    "origin=법령 인 모든 관계에 조문 출처와 시행일이 있다",
    "법령 노드의 검증상태가 미대조이면 그 노드를 끝점으로 하는 origin=법령 간선이 없다"
  ],
  "invariantTest": "pytest"
}
